<?xml version="1.0" encoding="UTF-8"?>
<class xmlns="http://www.romaframework.org/xml/roma" xmlns:xsd="http://www.w3.org/2001/XMLSchema-instance"
	xsd:schemaLocation="http://www.romaframework.org/xml/roma http://www.romaframework.org/schema/v3/roma.xsd">
	<aspects>
		<view columns="1" />
	</aspects>
	<fields>
		<field name="name" />
		<field name="type">
			<aspects>
				<view visible="false" />
			</aspects>
		</field>
		<field name="value">
			<aspects>
				<view enabled="false" />
			</aspects>
		</field>
		<field name="type" />
	</fields>
</class>