<?xml version="1.0" encoding="UTF-8"?>
<class xmlns="http://www.romaframework.org/xml/roma" xmlns:xsd="http://www.w3.org/2001/XMLSchema-instance"
	xsd:schemaLocation="http://www.romaframework.org/xml/roma http://www.romaframework.org/schema/v3/roma.xsd">
	<aspects>
		<view>
			<form>
				<area type="column">
					<area name="help" />
					<area name="fields" type="form" size="1" />
					<area name="actions" type="row" />
				</area>
			</form>
		</view>
	</aspects>
	<fields>
		<field name="help" />
		<field name="applicationName">
			<aspects>
				<view enabled="false" />
			</aspects>
		</field>
		<field name="applicationPackage">
			<aspects>
				<view enabled="false" />
			</aspects>
		</field>
		<field name="applicationVersion">
			<aspects>
				<view enabled="false" />
			</aspects>
		</field>
		<field name="applicationDevelopment" />
		<field name="status">
			<aspects>
				<view enabled="false" />
			</aspects>
		</field>
		<field name="aspectNames">
			<aspects>
				<view enabled="false" />
			</aspects>
		</field>
		<field name="moduleNames">
			<aspects>
				<view enabled="false" />
			</aspects>
		</field>
	</fields>
</class>