<?xml version="1.0" encoding="UTF-8"?>
<class xmlns="http://www.romaframework.org/xml/roma" xmlns:xsd="http://www.w3.org/2001/XMLSchema-instance"
	xsd:schemaLocation="http://www.romaframework.org/xml/roma http://www.romaframework.org/schema/v3/roma.xsd">
	<aspects>
		<view>
			<form>
				<area name="main" type="column">
					<area name="fields" type="form" size="3" />
					<area name="bottomPanel" type="row">
						<area name="notes" type="column" />
						<area name="configuration" type="column" />
					</area>
					<area name="groups" />
					<area name="actions" type="row" />
				</area>
			</form>
		</view>
	</aspects>
	<fields>
		<field name="groups">
			<aspects>
				<view visible="false" />
			</aspects>
		</field>
		<field name="name" />
		<field name="profile">
			<aspects>
				<validation required="true" />
			</aspects>
		</field>
		<field name="signedOn">
			<aspects>
				<view enabled="false" />
			</aspects>
		</field>
		<field name="lastModified">
			<aspects>
				<view enabled="false" />
			</aspects>
		</field>
		<field name="email">
			<aspects>
				<validation match="^[_a-z0-9-]+(\.?[_a-z0-9-]*)*@?[a-z0-9-]*(\.?[a-z0-9-]*)*$" />
			</aspects>
		</field>
		<field name="changePasswordNextLogin" />
		<field name="status">
			<aspects>
				<view visible="false" />
				<reporting visible="true" />
			</aspects>
		</field>
		<field name="notes">
			<aspects>
				<view render="textarea" />
			</aspects>
		</field>
		<field name="password">
			<aspects>
				<validation required="true" />
				<reporting visible="false" />
			</aspects>
		</field>
		<field name="confirmPassword">
			<aspects>
				<validation required="true" />
				<reporting visible="false" />
			</aspects>
		</field>
		<field name="statuses">
			<aspects>
				<reporting visible="false" />
			</aspects>
		</field>
		<field name="logoutAfterSave">
			<aspects>
				<reporting visible="false" />
			</aspects>
		</field>
		<field name="configuration"></field>
	</fields>
</class>